{
  "format": "detours-planning",
  "version": 1,
  "title": "Voyage fictif — 上海 et 苏州",
  "currency": "CNY",
  "timezone": "Asia/Shanghai",
  "cities": [
    {
      "name": "上海",
      "days": [
        {
          "title": "Jour 1 — arrivée",
          "date": "2027-05-03",
          "items": [
            {
              "type": "stay",
              "title": "Hôtel fictif Alpha",
              "category": "hotel",
              "description": null,
              "address": "Adresse fictive fournie",
              "time": null,
              "period": null,
              "checkIn": "2027-05-03",
              "checkOut": "2027-05-04",
              "from": null,
              "to": null,
              "mode": null,
              "departure": null,
              "arrival": null,
              "reservation": {
                "status": "confirmed",
                "reference": "FICTIF-001"
              }
            },
            {
              "type": "activity",
              "title": "Musée fictif",
              "category": "visit",
              "description": "Visite proposée par le planning fourni, sans billet confirmé.",
              "address": "虚构地址一号",
              "time": "14:00",
              "period": null,
              "checkIn": null,
              "checkOut": null,
              "from": null,
              "to": null,
              "mode": null,
              "departure": null,
              "arrival": null,
              "reservation": {
                "status": "unknown",
                "reference": null
              }
            },
            {
              "type": "transfer",
              "title": "Train fictif vers 苏州",
              "category": "transport",
              "description": null,
              "address": null,
              "time": null,
              "period": null,
              "checkIn": null,
              "checkOut": null,
              "from": "上海",
              "to": "苏州",
              "mode": "train",
              "departure": "2027-05-04T09:00",
              "arrival": "2027-05-04T10:00",
              "reservation": {
                "status": "unknown",
                "reference": null
              }
            }
          ]
        }
      ]
    },
    {
      "name": "苏州",
      "days": [
        {
          "title": "Jour 2 — jardin",
          "date": null,
          "items": [
            {
              "type": "suggestion",
              "title": "Jardin fictif",
              "category": "visit",
              "description": null,
              "address": null,
              "time": null,
              "period": "Matin",
              "checkIn": null,
              "checkOut": null,
              "from": null,
              "to": null,
              "mode": null,
              "departure": null,
              "arrival": null,
              "reservation": {
                "status": "unknown",
                "reference": null
              }
            },
            {
              "type": "alternative",
              "title": "Café fictif si pluie",
              "category": "food",
              "description": "Alternative non réservée.",
              "address": null,
              "time": null,
              "period": null,
              "checkIn": null,
              "checkOut": null,
              "from": null,
              "to": null,
              "mode": null,
              "departure": null,
              "arrival": null,
              "reservation": {
                "status": "unknown",
                "reference": null
              }
            }
          ]
        }
      ]
    }
  ],
  "notes": [
    "English note: confirm opening hours.",
    "备注：保留原文。"
  ],
  "ambiguities": [
    "La date du jardin reste inconnue."
  ],
  "unmapped": [
    "Estimation fournie : 80 CNY, non payée ; aucune dépense créée."
  ]
}
